title,authors,year,abstract,ss_id
Column Stores as an IR Prototyping Tool,"[{'name': 'Hannes Mühleisen', 'dblp_profile': 'https://dblp.org/pid/25/9489.html'}, {'name': 'Thaer Samar', 'dblp_profile': 'https://dblp.org/pid/143/3619.html'}, {'name': 'Jimmy Lin', 'dblp_profile': 'https://dblp.org/pid/00/7739'}, {'name': 'Arjen P. de Vries', 'dblp_profile': 'https://dblp.org/pid/v/ArjenPdeVries.html'}]",2014,,f9af1d4ba22802a57c0318f7028ed35d779c7b9e
"Optimization Techniques for ""Scaling Down"" Hadoop on Multi-Core, Shared-Memory Systems","[{'name': 'K. Ashwin Kumar', 'dblp_profile': 'https://dblp.org/pid/86/4593.html'}, {'name': 'Jonathan Gluck', 'dblp_profile': 'https://dblp.org/pid/135/4686.html'}, {'name': 'Amol Deshpande', 'dblp_profile': 'https://dblp.org/pid/d/AmolDeshpande.html'}, {'name': 'Jimmy Lin', 'dblp_profile': 'https://dblp.org/pid/00/7739'}]",2014,"The underlying assumption behind Hadoop and, more generally, the need for distributed processing is that the data to be analyzed cannot be held in memory on a single machine. Today, this assumption needs to be re-evaluated. Although petabyte-scale datastores are increasingly common, it is unclear whether “typical” analytics tasks require more than a single high-end server. Additionally, we are seeing increased sophistication in analytics, e.g., machine learning, where we process smaller and more refined datasets. To address these trends, we propose “scaling down” Hadoop to run on multi-core, shared-memory machines. This paper presents a prototype runtime called Hone (“Hadoop One”) that is API compatible with Hadoop. With Hone, we can take an existing Hadoop application and run it efficiently on a single server. This allows us to take existing MapReduce algorithms and find the most suitable runtime environment for execution on datasets of varying sizes. For dataset sizes that fit into memory on a single machine, our experiments show that Hone is substantially faster than Hadoop running in pseudo-distributed mode. In some cases, Hone running on a single machine outperforms a 16-node Hadoop cluster.",0a4b1e6f12e4b205ae8004dd3f5b7c522c0b4950
Partitioning strategies for spatio-textual similarity join,"[{'name': 'Jinfeng Rao', 'dblp_profile': 'https://dblp.org/pid/134/5708.html'}, {'name': 'Jimmy Lin', 'dblp_profile': 'https://dblp.org/pid/00/7739'}, {'name': 'Hanan Samet', 'dblp_profile': 'https://dblp.org/pid/s/HananSamet.html'}]",2014,"Given a collection of geo-tagged objects with associated textual descriptors, the spatio-textual similarity join (STJoin) problem is to identify all pairs of similar objects that are close in distance. This task, which is useful in localized recommendations and other applications, is challenging since computing the join is super-linear with respect to the size of the collection. In this paper, we explore partitioning strategies for tackling STJoin. One approach is to start with a spatial data structure, traverse regions and apply a previous algorithm for identifying similar pairs of textual documents called All-Pairs. An alternative approach is to construct a global index but partition postings spatially and modify the All-Pairs algorithm to prune candidates based on distance. We evaluate these approaches on two real-world datasets and find that when running in a single thread, both approaches are comparable in terms of performance. However, a multi-threaded implementation of the global index approach is able to achieve far better speedup given its ability to parallelize at a finer granularity to avoid skewed distributions in task sizes. In addition to using All-Pairs as the underlying textual similarity join algorithm, we also explored an alternate algorithm known as PPJ: our findings are consistent, which suggests that load balancing is a fundamental issue affecting parallel implementations of STJoin algorithms.",36e9e630a8ba725b905806be89570c68f16537ab
Using visualizations to monitor changes and harvest insights from a global-scale logging infrastructure at Twitter,"[{'name': 'Krist Wongsuphasawat', 'dblp_profile': 'https://dblp.org/pid/78/7577.html'}, {'name': 'Jimmy Lin', 'dblp_profile': 'https://dblp.org/pid/00/7739'}]",2014,"Logging user activities is essential to data analysis for internet products and services. Twitter has built a unified logging infrastructure that captures user activities across all clients it owns, making it one of the largest datasets in the organization. This paper describes challenges and opportunities in applying information visualization to log analysis at this massive scale, and shows how various visualization techniques can be adapted to help data scientists extract insights. In particular, we focus on two scenarios: (1) monitoring and exploring a large collection of log events, and (2) performing visual funnel analysis on log data with tens of thousands of event types. Two interactive visualizations were developed for these purposes: we discuss design choices and the implementation of these systems, along with case studies of how they are being used in day-to-day operations at Twitter.",3c5154d3aa120eb8d597af7db512bef1068882e6
Visual analytics of MOOCs at maryland,"[{'name': 'Zhengzheng Xu', 'dblp_profile': 'https://dblp.org/pid/10/10201.html'}, {'name': 'Dan Goldwasser', 'dblp_profile': 'https://dblp.org/pid/38/3382.html'}, {'name': 'Benjamin B. Bederson', 'dblp_profile': 'https://dblp.org/pid/b/BenBederson.html'}, {'name': 'Jimmy Lin', 'dblp_profile': 'https://dblp.org/pid/00/7739'}]",2014,"We use visual analytics to explore participation in five MOOCs at the University of Maryland. In some of these courses, our analysis reveals interesting clustering patterns of student behavior. For other courses, visualizations provide ""color"" to help us better understand the range of student behavior.",81555e631d369b5b37d6d715c55db9f72c8589a3
Temporal feedback for tweet search with non-parametric density estimation,"[{'name': 'Miles Efron', 'dblp_profile': 'https://dblp.org/pid/41/3635.html'}, {'name': 'Jimmy Lin', 'dblp_profile': 'https://dblp.org/pid/00/7739'}, {'name': 'Jiyin He', 'dblp_profile': 'https://dblp.org/pid/05/5662.html'}, {'name': 'Arjen P. de Vries', 'dblp_profile': 'https://dblp.org/pid/v/ArjenPdeVries.html'}]",2014,"This paper investigates the temporal cluster hypothesis: in search tasks where time plays an important role, do relevant documents tend to cluster together in time? We explore this question in the context of tweet search and temporal feedback: starting with an initial set of results from a baseline retrieval model, we estimate the temporal density of relevant documents, which is then used for result reranking. Our contributions lie in a method to characterize this temporal density function using kernel density estimation, with and without human relevance judgments, and an approach to integrating this information into a standard retrieval model. Experiments on TREC datasets confirm that our temporal feedback formulation improves search effectiveness, thus providing support for our hypothesis. Our approach out-performs both a standard baseline and previous temporal retrieval models. Temporal feedback improves over standard lexical feedback (with and without human judgments), illus- trating that temporal relevance signals exist independently of document content.",97c51aa284a44ddeaef78b50b2bfb90acba12500
Old dogs are great at new tricks: column stores for ir prototyping,"[{'name': 'Hannes Mühleisen', 'dblp_profile': 'https://dblp.org/pid/25/9489.html'}, {'name': 'Thaer Samar', 'dblp_profile': 'https://dblp.org/pid/143/3619.html'}, {'name': 'Jimmy Lin', 'dblp_profile': 'https://dblp.org/pid/00/7739'}, {'name': 'Arjen P. de Vries', 'dblp_profile': 'https://dblp.org/pid/v/ArjenPdeVries.html'}]",2014,"We make the suggestion that instead of implementing custom index structures and query evaluation algorithms, IR researchers should simply store document representations in a column-oriented relational database and implement ranking models using SQL. For rapid prototyping, this is particularly advantageous since researchers can explore new scoring functions and features by simply issuing SQL queries, without needing to write imperative code. We demonstrate the feasibility of this approach by an implementation of conjunctive BM25 using two modern column stores. Experiments on a web collection show that a retrieval engine built in this manner achieves effectiveness and efficiency on par with custom-built retrieval engines, but provides many additional advantages, including cleaner query semantics, a simpler architecture, built-in support for error analysis, and the ability to exploit advances in database technology ""for free"".",1e390cf4ecfeae3c8f22ac73411792e06fb3eb66
On run diversity in Evaluation as a Service,"[{'name': 'Ellen M. Voorhees', 'dblp_profile': 'https://dblp.org/pid/60/3753.html'}, {'name': 'Jimmy Lin', 'dblp_profile': 'https://dblp.org/pid/00/7739'}, {'name': 'Miles Efron', 'dblp_profile': 'https://dblp.org/pid/41/3635.html'}]",2014,"""Evaluation as a service"" (EaaS) is a new methodology that enables community-wide evaluations and the construction of test collections on documents that cannot be distributed. The basic idea is that evaluation organizers provide a service API through which the evaluation task can be completed. However, this concept violates some of the premises of traditional pool-based collection building and thus calls into question the quality of the resulting test collection. In particular, the service API might restrict the diversity of runs that contribute to the pool: this might hamper innovation by researchers and lead to incomplete judgment pools that affect the reusability of the collection. This paper shows that the distinctiveness of the retrieval runs used to construct the first test collection built using EaaS, the TREC 2013 Microblog collection, is not substantially different from that of the TREC-8 ad hoc collection, a high-quality collection built using traditional pooling. Further analysis using the `leave out uniques' test suggests that pools from the Microblog 2013 collection are less complete than those from TREC-8, although both collections benefit from the presence of distinctive and effective manual runs. Although we cannot yet generalize to all EaaS implementations, our analyses reveal no obvious flaws in the test collection built using the methodology in the TREC 2013 Microblog track.",4ec509cfcda5025fa65ed13ee033cfaf374ba8ab
Overview of the TREC-2014 Microblog Track,"[{'name': 'Jimmy Lin', 'dblp_profile': 'https://dblp.org/pid/00/7739'}, {'name': 'Yulu Wang', 'dblp_profile': 'https://dblp.org/pid/143/3574.html'}, {'name': 'Miles Efron', 'dblp_profile': 'https://dblp.org/pid/41/3635.html'}, {'name': 'Garrick Sherman', 'dblp_profile': 'https://dblp.org/pid/147/9142.html'}]",2014,"Abstract : This year represents the fourth iteration of the TREC Microblog track, which has been running since 2011. The track continued using the evaluation as a service model [8, 7], in which participants had access to the document collection only through an API. In addition to the temporally-anchored ad hoc retrieval task, which has been running since the inception of the track, we introduced a new task called tweet timeline generation (TTG), where the goal is to produce concise summaries about a particular topic for human consumption. Although this overview covers both tasks, more emphasis is placed on the tweet timeline generation task, which necessitated the development of a new evaluation methodology. We refer the reader to previous track overview papers [8, 12, 9] for details on the setup of the ad hoc task.",5c32734fd4a0765db5c11971f8293e4e2089e5ce
Infrastructure support for evaluation as a service,"[{'name': 'Jimmy Lin', 'dblp_profile': 'https://dblp.org/pid/00/7739'}, {'name': 'Miles Efron', 'dblp_profile': 'https://dblp.org/pid/41/3635.html'}]",2014,"How do we conduct large-scale community-wide evaluations for information retrieval if we are unable to distribute the document collection? This was the challenge we faced in organizing a task on searching tweets at the Text Retrieval Conference (TREC), since Twitter's terms of service forbid redistribution of tweets. Our solution, which we call ""evaluation as a service"", was to provide an API through which the collection can be accessed for completing the evaluation task. This paper describes the infrastructure underlying the service and its deployment at TREC 2013. We discuss the merits of the approach and potential applicability to other evaluation scenarios.",0adc23fdd59b13afe9872d6d77b62d1318120015
Learning to efficiently rank on big data,"[{'name': 'Lidan Wang', 'dblp_profile': 'https://dblp.org/pid/03/2525.html'}, {'name': 'Jimmy Lin', 'dblp_profile': 'https://dblp.org/pid/00/7739'}, {'name': 'Donald Metzler', 'dblp_profile': 'https://dblp.org/pid/95/2272.html'}, {'name': 'Jiawei Han', 'dblp_profile': 'https://dblp.org/pid/h/JiaweiHan.html'}]",2014,"Ranking in response to user queries is a central problem in information retrieval, data mining, and machine learning. In the era of ""Big data"", traditional effectiveness-centric ranking techniques tend to get more and more costly (requiring additional hardware and energy costs) to sustain reasonable ranking speed on large data. The mentality of combating big data by throwing in more hardware/machines will quickly become highly expensive since data is growing at an extremely fast rate oblivious to any cost concerns from us. ""Learning to efficiently rank"" offers a cost-effective solution to ranking on large data (e.g., billions of documents). That is, it addresses a critically important question -- whether it is possible to improve ranking effectiveness on large data without incurring (too much) additional cost?",35fe34e8e08f1d301c4a25c83707d784a8292e46
Information network or social network?: the structure of the twitter follow graph,"[{'name': 'Seth A. Myers', 'dblp_profile': 'https://dblp.org/pid/62/8656.html'}, {'name': 'Aneesh Sharma', 'dblp_profile': 'https://dblp.org/pid/78/6674.html'}, {'name': 'Pankaj Gupta', 'dblp_profile': 'https://dblp.org/pid/92/4081-2.html'}, {'name': 'Jimmy Lin', 'dblp_profile': 'https://dblp.org/pid/00/7739'}]",2014,"In this paper, we provide a characterization of the topological features of the Twitter follow graph, analyzing properties such as degree distributions, connected components, shortest path lengths, clustering coefficients, and degree assortativity. For each of these properties, we compare and contrast with available data from other social networks. These analyses provide a set of authoritative statistics that the community can reference. In addition, we use these data to investigate an often-posed question: Is Twitter a social network or an information network? The ""follow"" relationship in Twitter is primarily about information consumption, yet many follows are built on social ties. Not surprisingly, we find that the Twitter follow graph exhibits structural characteristics of both an information network and a social network. Going beyond descriptive characterizations, we hypothesize that from an individual user's perspective, Twitter starts off more like an information network, but evolves to behave more like a social network. We provide preliminary evidence that may serve as a formal model of how a hybrid network like Twitter evolves.",d055b02f7511ccf22ce6a00f3569d0a84278f5bd
Infrastructure for supporting exploration and discovery in web archives,"[{'name': 'Jimmy Lin', 'dblp_profile': 'https://dblp.org/pid/00/7739'}, {'name': 'Milad Gholami', 'dblp_profile': 'https://dblp.org/pid/120/1847.html'}, {'name': 'Jinfeng Rao', 'dblp_profile': 'https://dblp.org/pid/134/5708.html'}]",2014,"Web archiving initiatives around the world capture ephemeral web content to preserve our collective digital memory. However, unlocking the potential of web archives requires tools that support exploration and discovery of captured content. These tools need to be scalable and responsive, and to this end we believe that modern ""big data"" infrastructure can provide a solid foundation. We present Warcbase, an open-source platform for managing web archives built on the distributed datastore HBase. Our system provides a flexible data model for storing and managing raw content as well as metadata and extracted knowledge. Tight integration with Hadoop provides powerful tools for analytics and data processing. Relying on HBase for storage infrastructure simplifies the development of scalable and responsive applications. We describe a service that provides temporal browsing and an interactive visualization based on topic models that allows users to explore archived content.",7bba909bc4f20a43e021b1f6fb36dfbf03503a8c
NScale: Neighborhood-centric Large-Scale Graph Analytics in the Cloud,"[{'name': 'Abdul Quamar', 'dblp_profile': 'https://dblp.org/pid/127/6195.html'}, {'name': 'Amol Deshpande', 'dblp_profile': 'https://dblp.org/pid/d/AmolDeshpande.html'}, {'name': 'Jimmy Lin', 'dblp_profile': 'https://dblp.org/pid/00/7739'}]",2014,,073fed4761d408025035cb60d7d82dddd20ebbf7
Identifying Duplicate and Contradictory Information in Wikipedia,"[{'name': 'Sarah Weissman', 'dblp_profile': 'https://dblp.org/pid/147/5240.html'}, {'name': 'Samet Ayhan', 'dblp_profile': 'https://dblp.org/pid/147/5343.html'}, {'name': 'Joshua Bradley', 'dblp_profile': 'https://dblp.org/pid/147/4908.html'}, {'name': 'Jimmy Lin', 'dblp_profile': 'https://dblp.org/pid/00/7739'}]",2014,"In this paper, we identify sentences in Wikipedia articles that are either identical or highly similar by applying techniques for near-duplicate detection of web pages. This is accomplished with a MapReduce implementation of minhash to identify sentences with high Jaccard similarity, followed by a pass to generate sentence clusters. Based on manual examination, we discovered that these clusters can be categorized into six different types: templates, identical sentences, copyediting, factual drift, references, and other. Two of these categories are particularly interesting: identical sentences quantify the extent to which content in Wikipedia is copied and pasted, and near-duplicate sentences that state contradictory facts point to quality issues in Wikipedia.",91dbe227966e90dce6a5b5f7936cb8037ecf0e92
On the Feasibility and Implications of Self-Contained Search Engines in the Browser,"[{'name': 'Jimmy Lin', 'dblp_profile': 'https://dblp.org/pid/00/7739'}]",2014,"JavaScript engines inside modern browsers are capable of running sophisticated multi-player games, rendering impressive 3D scenes, and supporting complex, interactive visualizations. Can this processing power be harnessed for information retrieval? This paper explores the feasibility of building a JavaScript search engine that runs completely self-contained on the client side within the browser---this includes building the inverted index, gathering terms statistics for scoring, and performing query evaluation. The design takes advantage of the IndexDB API, which is implemented by the LevelDB key-value store inside Google's Chrome browser. Experiments show that although the performance of the JavaScript prototype falls far short of the open-source Lucene search engine, it is sufficiently responsive for interactive applications. This feasibility demonstration opens the door to interesting applications in offline and private search across multiple platforms as well as hybrid split-execution architectures whereby clients and servers collaboratively perform query evaluation. One possible future scenario is the rise of an online search marketplace in which commercial search engine companies and individual users participate as rational economic actors, balancing privacy, resource usage, latency, and other factors based on customizable utility profiles.",058f2abb194f579408c14afc26cb12cce698ba3c
"Mapreduce is Good Enough?If All You Have is a Hammer, Throw Away Everything That's Not a Nail!","[{'name': 'Jimmy Lin', 'dblp_profile': 'https://dblp.org/pid/00/7739'}]",2013,,
Document vector representations for feature extraction in multi-stage document ranking,"[{'name': 'Nima Asadi', 'dblp_profile': 'https://dblp.org/pid/62/4319-1.html'}, {'name': 'Jimmy Lin', 'dblp_profile': 'https://dblp.org/pid/00/7739'}]",2013,,ccb224b95bc879b7914d0a2c2915f6694fe6160e
"Hone: ""Scaling Down"" Hadoop on Shared-Memory Systems","[{'name': 'K. Ashwin Kumar', 'dblp_profile': 'https://dblp.org/pid/86/4593.html'}, {'name': 'Jonathan Gluck', 'dblp_profile': 'https://dblp.org/pid/135/4686.html'}, {'name': 'Amol Deshpande', 'dblp_profile': 'https://dblp.org/pid/d/AmolDeshpande.html'}, {'name': 'Jimmy Lin', 'dblp_profile': 'https://dblp.org/pid/00/7739'}]",2013,"The underlying assumption behind Hadoop and, more generally, the need for distributed processing is that the data to be analyzed cannot be held in memory on a single machine. Today, this assumption needs to be re-evaluated. Although petabyte-scale data-stores are increasingly common, it is unclear whether ""typical"" analytics tasks require more than a single high-end server. Additionally, we are seeing increased sophistication in analytics, e.g., machine learning, which generally operates over smaller and more refined datasets. To address these trends, we propose ""scaling down"" Hadoop to run on shared-memory machines. This paper presents a prototype runtime called Hone, intended to be both API and binary compatible with standard (distributed) Hadoop. That is, Hone can take an existing Hadoop jar and efficiently execute it, without modification, on a multi-core shared memory machine. This allows us to take existing Hadoop algorithms and find the most suitable run-time environment for execution on datasets of varying sizes. Our experiments show that Hone can be an order of magnitude faster than Hadoop pseudo-distributed mode (PDM); on dataset sizes that fit into memory, Hone can outperform a fully-distributed 15-node Hadoop cluster in some cases as well.",764e859f616401f7a0b2da069d7b4036e31ac33b
Evaluation as a service for information retrieval,"[{'name': 'Jimmy Lin', 'dblp_profile': 'https://dblp.org/pid/00/7739'}, {'name': 'Miles Efron', 'dblp_profile': 'https://dblp.org/pid/41/3635.html'}]",2013,"How can we run large-scale, community-wide evaluations of information retrieval systems if we lack the ability to distribute the document collection on which the task is based? This was the challenge we faced in the TREC Microblog tracks over the past few years. In this paper, we present a novel evaluation methodology we dub ""evaluation as a service"", which was implemented at TREC 2013 to address restrictions on data redistribution. The basic idea is that instead of distributing the document collection, we (the track organizers) provided a service API ""in the cloud"" with which participants could accomplish the evaluation task. We outline advantages as well as disadvantages of this evaluation methodology, and discuss how the approach might be extended to other evaluation scenarios.",475b023e9b0914025fdc030ee343e60004a53fea
Fast candidate generation for real-time tweet search with bloom filter chains,"[{'name': 'Nima Asadi', 'dblp_profile': 'https://dblp.org/pid/62/4319-1.html'}, {'name': 'Jimmy Lin', 'dblp_profile': 'https://dblp.org/pid/00/7739'}]",2013,"The rise of social media and other forms of user-generated content have created the demand for real-time search: against a high-velocity stream of incoming documents, users desire a list of relevant results at the time the query is issued. In the context of real-time search on tweets, this work explores candidate generation in a two-stage retrieval architecture where an initial list of results is processed by a second-stage rescorer to produce the final output. We introduce Bloom filter chains, a novel extension of Bloom filters that can dynamically expand to efficiently represent an arbitrarily long and growing list of monotonically-increasing integers with a constant false positive rate. Using a collection of Bloom filter chains, a novel approximate candidate generation algorithm called BWand is able to perform both conjunctive and disjunctive retrieval. Experiments show that our algorithm is many times faster than competitive baselines and that this increased performance does not require sacrificing end-to-end effectiveness. Our results empirically characterize the trade-off space defined by output quality, query evaluation speed, and memory footprint for this particular search architecture.",4c93c4130964c55134bcbb4aa91bfa30376e57e3
Mr. MIRA: Open-Source Large-Margin Structured Learning on MapReduce,"[{'name': 'Vladimir Eidelman', 'dblp_profile': 'https://dblp.org/pid/58/8159.html'}, {'name': 'Ke Wu', 'dblp_profile': 'https://dblp.org/pid/69/6116.html'}, {'name': 'Ferhan Türe', 'dblp_profile': 'https://dblp.org/pid/02/4537.html'}, {'name': 'Philip Resnik', 'dblp_profile': 'https://dblp.org/pid/p/PhilipResnik.html'}, {'name': 'Jimmy Lin', 'dblp_profile': 'https://dblp.org/pid/00/7739'}]",2013,"We present an open-source framework for large-scale online structured learning. Developed with the flexibility to handle cost-augmented inference problems such as statistical machine translation (SMT), our large-margin learner can be used with any decoder. Integration with MapReduce using Hadoop streaming allows efficient scaling with increasing size of training data. Although designed with a focus on SMT, the decoder-agnostic design of our learner allows easy future extension to other structured learning problems such as sequence labeling and parsing.",adea93b44984e95c597e8c6f3284360a5fc5f214
