title,authors,year,abstract,ss_id
In-Batch Negatives for Knowledge Distillation with Tightly-Coupled Teachers for Dense Retrieval,"[{'name': 'Sheng-Chieh Lin', 'dblp_profile': 'https://dblp.org/pid/61/10361.html'}, {'name': 'Jheng-Hong Yang', 'dblp_profile': 'https://dblp.org/pid/227/0821.html'}, {'name': 'Jimmy Lin', 'dblp_profile': 'https://dblp.org/pid/00/7739'}]",2021,"We present an efficient training approach to text retrieval with dense representations that applies knowledge distillation using the ColBERT late-interaction ranking model. Specifically, we propose to transfer the knowledge from a bi-encoder teacher to a student by distilling knowledge from ColBERT’s expressive MaxSim operator into a simple dot product. The advantage of the bi-encoder teacher–student setup is that we can efficiently add in-batch negatives during knowledge distillation, enabling richer interactions between teacher and student models. In addition, using ColBERT as the teacher reduces training cost compared to a full cross-encoder. Experiments on the MS MARCO passage and document ranking tasks and data from the TREC 2019 Deep Learning Track demonstrate that our approach helps models learn robust representations for dense retrieval effectively and efficiently.",2c74e7258e7c89ca2da1784fb0cb4106a23ac382
Efficiently Teaching an Effective Dense Retriever with Balanced Topic Aware Sampling,"[{'name': 'Sebastian Hofstätter', 'dblp_profile': 'https://dblp.org/pid/238/6322.html'}, {'name': 'Sheng-Chieh Lin', 'dblp_profile': 'https://dblp.org/pid/61/10361.html'}, {'name': 'Jheng-Hong Yang', 'dblp_profile': 'https://dblp.org/pid/227/0821.html'}, {'name': 'Jimmy Lin', 'dblp_profile': 'https://dblp.org/pid/00/7739'}, {'name': 'Allan Hanbury', 'dblp_profile': 'https://dblp.org/pid/55/6683.html'}]",2021,"A vital step towards the widespread adoption of neural retrieval models is their resource efficiency throughout the training, indexing and query workflows. The neural IR community made great advancements in training effective dual-encoder dense retrieval (DR) models recently. A dense text retrieval model uses a single vector representation per query and passage to score a match, which enables low-latency first-stage retrieval with a nearest neighbor search. Increasingly common, training approaches require enormous compute power, as they either conduct negative passage sampling out of a continuously updating refreshing index or require very large batch sizes. Instead of relying on more compute capability, we introduce an efficient topic-aware query and balanced margin sampling technique, called TAS-Balanced. We cluster queries once before training and sample queries out of a cluster per batch. We train our lightweight 6-layer DR model with a novel dual-teacher supervision that combines pairwise and in-batch negative teachers. Our method is trainable on a single consumer-grade GPU in under 48 hours. We show that our TAS-Balanced training method achieves state-of-the-art low-latency (64ms per query) results on two TREC Deep Learning Track query sets. Evaluated on NDCG@10, we outperform BM25 by 44%, a plainly trained DR by 19%, docT5query by 11%, and the previous best DR model by 5%. Additionally, TAS-Balanced produces the first dense retriever that outperforms every other method on recall at any cutoff on TREC-DL and allows more resource intensive re-ranking models to operate on fewer passages to improve results further.",4deed74a3eee7e629dce2b8ef1e437ca74b2e64a
MS MARCO: Benchmarking Ranking Models in the Large-Data Regime,"[{'name': 'Nick Craswell', 'dblp_profile': 'https://dblp.org/pid/c/NickCraswell.html'}, {'name': 'Bhaskar Mitra', 'dblp_profile': 'https://dblp.org/pid/147/9120-1.html'}, {'name': 'Emine Yilmaz', 'dblp_profile': 'https://dblp.org/pid/36/3270.html'}, {'name': 'Daniel Campos', 'dblp_profile': 'https://dblp.org/pid/64/1314.html'}, {'name': 'Jimmy Lin', 'dblp_profile': 'https://dblp.org/pid/00/7739'}]",2021,"Evaluation efforts such as TREC, CLEF, NTCIR and FIRE, alongside public leaderboard such as MS MARCO, are intended to encourage research and track our progress, addressing big questions in our field. However, the goal is not simply to identify which run is ""best"", achieving the top score. The goal is to move the field forward by developing new robust techniques, that work in many different settings, and are adopted in research and practice. This paper uses the MS MARCO and TREC Deep Learning Track as our case study, comparing it to the case of TREC ad hoc ranking in the 1990s. We show how the design of the evaluation effort can encourage or discourage certain outcomes, and raising questions about internal and external validity of results. We provide some analysis of certain pitfalls, and a statement of best practices for avoiding such pitfalls. We summarize the progress of the effort so far, and describe our desired end state of ""robust usefulness"", along with steps that might be required to get us there.",591cb4d880dbebcc934623738f0a6f4e92fdc40f
Vera: Prediction Techniques for Reducing Harmful Misinformation in Consumer Health Search,"[{'name': 'Ronak Pradeep', 'dblp_profile': 'https://dblp.org/pid/270/1757.html'}, {'name': 'Xueguang Ma', 'dblp_profile': 'https://dblp.org/pid/44/9030.html'}, {'name': 'Rodrigo Frassetto Nogueira', 'dblp_profile': 'https://dblp.org/pid/175/1545.html'}, {'name': 'Jimmy Lin', 'dblp_profile': 'https://dblp.org/pid/00/7739'}]",2021,"The COVID-19 pandemic has brought about a proliferation of harmful news articles online, with sources lacking credibility and misrepresenting scientific facts. Misinformation has real consequences for consumer health search, i.e., users searching for health information. In the context of multi-stage ranking architectures, there has been little work exploring whether they prioritize correct and credible information over misinformation. We find that, indeed, training models on standard relevance ranking datasets like MS MARCO passage---which have been curated to contain mostly credible information---yields models that might also promote harmful misinformation. To rectify this, we propose a label prediction technique that can separate helpful from harmful content. Our design leverages pretrained sequence-to-sequence transformer models for both relevance ranking and label prediction. Evaluated at the TREC 2020 Health Misinformation Track, our techniques represent the top-ranked system: Our best submitted run was 19.2 points higher than the second-best run based on the primary metric, a 68% relative improvement. Additional post-hoc experiments show that we can boost effectiveness by another 3.5 points.",7a4c0523dbb99e2b437ab8e222420e193a517686
Significant Improvements over the State of the Art? A Case Study of the MS MARCO Document Ranking Leaderboard,"[{'name': 'Jimmy Lin', 'dblp_profile': 'https://dblp.org/pid/00/7739'}, {'name': 'Daniel Campos', 'dblp_profile': 'https://dblp.org/pid/64/1314.html'}, {'name': 'Nick Craswell', 'dblp_profile': 'https://dblp.org/pid/c/NickCraswell.html'}, {'name': 'Bhaskar Mitra', 'dblp_profile': 'https://dblp.org/pid/147/9120-1.html'}, {'name': 'Emine Yilmaz', 'dblp_profile': 'https://dblp.org/pid/36/3270.html'}]",2021,"Leaderboards are a ubiquitous part of modern research in applied machine learning. By design, they sort entries into some linear order, where the top-scoring entry is recognized as the ""state of the art"" (SOTA). Due to the rapid progress being made today, particularly with neural models, the top entry in a leaderboard is replaced with some regularity. These are touted as improvements in the state of the art. Such pronouncements, however, are almost never qualified with significance testing. In the context of the MS MARCO document ranking leaderboard, we pose a specific question: How do we know if a run is significantly better than the current SOTA? Against the backdrop of recent IR debates on scale types, our study proposes an evaluation framework that explicitly treats certain outcomes as distinct and avoids aggregating them into a single-point metric. Empirical analysis of SOTA runs from the MS MARCO document ranking leaderboard reveals insights about how one run can be ""significantly better"" than another that are obscured by the current official evaluation metric (MRR@100).",6ee287800c2aecef59d2b1d98c0ebfcab4294f53
Pyserini: A Python Toolkit for Reproducible Information Retrieval Research with Sparse and Dense Representations,"[{'name': 'Jimmy Lin', 'dblp_profile': 'https://dblp.org/pid/00/7739'}, {'name': 'Xueguang Ma', 'dblp_profile': 'https://dblp.org/pid/44/9030.html'}, {'name': 'Sheng-Chieh Lin', 'dblp_profile': 'https://dblp.org/pid/61/10361.html'}, {'name': 'Jheng-Hong Yang', 'dblp_profile': 'https://dblp.org/pid/227/0821.html'}, {'name': 'Ronak Pradeep', 'dblp_profile': 'https://dblp.org/pid/270/1757.html'}, {'name': 'Rodrigo Frassetto Nogueira', 'dblp_profile': 'https://dblp.org/pid/175/1545.html'}]",2021,"Pyserini is a Python toolkit for reproducible information retrieval research with sparse and dense representations. It aims to provide effective, reproducible, and easy-to-use first-stage retrieval in a multi-stage ranking architecture. Our toolkit is self-contained as a standard Python package and comes with queries, relevance judgments, pre-built indexes, and evaluation scripts for many commonly used IR test collections. We aim to support, out of the box, the entire research lifecycle of efforts aimed at improving ranking with modern neural approaches. In particular, Pyserini supports sparse retrieval (e.g., BM25 scoring using bag-of-words representations), dense retrieval (e.g., nearest-neighbor search on transformer-encoded representations), as well as hybrid retrieval that integrates both approaches. This paper provides an overview of toolkit features and presents empirical results that illustrate its effectiveness on two popular ranking tasks. Around this toolkit, our group has built a culture of reproducibility through shared norms and tools that enable rigorous automated testing.",d69c0ed04ecc852e8c921900d3e7967f74f81263
Chatty Goose: A Python Framework for Conversational Search,"[{'name': 'Edwin Zhang', 'dblp_profile': 'https://dblp.org/pid/262/6436.html'}, {'name': 'Sheng-Chieh Lin', 'dblp_profile': 'https://dblp.org/pid/61/10361.html'}, {'name': 'Jheng-Hong Yang', 'dblp_profile': 'https://dblp.org/pid/227/0821.html'}, {'name': 'Ronak Pradeep', 'dblp_profile': 'https://dblp.org/pid/270/1757.html'}, {'name': 'Rodrigo Frassetto Nogueira', 'dblp_profile': 'https://dblp.org/pid/175/1545.html'}, {'name': 'Jimmy Lin', 'dblp_profile': 'https://dblp.org/pid/00/7739'}]",2021,"Chatty Goose is an open-source Python conversational search framework that provides strong, reproducible reranking pipelines built on recent advances in neural models. The framework comprises extensible modular components that integrate with popular libraries such as Transformers by HuggingFace and ParlAI by Facebook. Our aim is to lower the barrier of entry for research in conversational search by providing reproducible baselines that researchers can build on top of. We provide an overview of the framework and demonstrate how to instantiate a new system from scratch. Chatty Goose incorporates improvements to components that we introduced in the TREC 2019 Conversational Assistance Track (CAsT), where our submission represented the top-performing system. Using our framework, a comparable run can be reproduced with just a few lines of code.",007a06e9674f58d496ef36ef54a2fd1363299c08
PYA0: A Python Toolkit for Accessible Math-Aware Search,"[{'name': 'Wei Zhong', 'dblp_profile': 'https://dblp.org/pid/60/1416.html'}, {'name': 'Jimmy Lin', 'dblp_profile': 'https://dblp.org/pid/00/7739'}]",2021,"Mathematical Information Retrieval (MIR) has been actively studied in recent years and many fruitful results have emerged. Among those, the Approach Zero system is one of the few math-aware search engines that is able to perform substructure matching efficiently. Furthermore, it has been deployed in ARQMath2020, the most recent community-wide MIR evaluation, as a strong baseline due to its empirical effectiveness and ability to handle structured math content. However, in order to implement a retrieval model that handles structured queries efficiently, Approach Zero is written in C from the ground up, requiring special pipelines for processing math content and queries. Thus, the system is not conveniently accessible and reusable to the community as a research tool. In this paper, we present PyA0, an easy-to-use Python toolkit built on Approach Zero that improves its accessibility to researchers. We introduce the toolkit interface and report evaluation results on popular MIR datasets to demonstrate the effectiveness and efficiency of our toolkit. We have made PyA0 source code publicly accessible at https://github.com/approach0/pya0, which includes a link to a notebook demo.",398c7443dfb39319632d0766f6facb2ee2783e71
Pretrained Transformers for Text Ranking: BERT and Beyond,"[{'name': 'Andrew Yates', 'dblp_profile': 'https://dblp.org/pid/49/7109.html'}, {'name': 'Rodrigo Frassetto Nogueira', 'dblp_profile': 'https://dblp.org/pid/175/1545.html'}, {'name': 'Jimmy Lin', 'dblp_profile': 'https://dblp.org/pid/00/7739'}]",2021,"The goal of text ranking is to generate an ordered list of texts retrieved from a corpus in response to a query. Although the most common formulation of text ranking is search, instances of the task can also be found in many natural language processing applications. This tutorial, based on a forthcoming book, provides an overview of text ranking with neural network architectures known as transformers, of which BERT is the best-known example. The combination of transformers and self-supervised pretraining has, without exaggeration, revolutionized the fields of natural language processing (NLP), information retrieval (IR), and beyond. We provide a synthesis of existing work as a single point of entry for both researchers and practitioners. Our coverage is grouped into two categories: transformer models that perform reranking in multi-stage ranking architectures and learned dense representations that perform ranking directly. Two themes pervade our treatment: techniques for handling long documents and techniques for addressing the tradeoff between effectiveness (result quality) and efficiency (query latency). Although transformer architectures and pretraining techniques are recent innovations, many aspects of their application are well understood. Nevertheless, there remain many open research questions, and thus in addition to laying out the foundations of pretrained transformers for text ranking, we also attempt to prognosticate the future.",88b0eea7050c3322162c0cf18b2ccb014c4d17ad
Overview of the TREC 2021 Deep Learning Track,"[{'name': 'Nick Craswell', 'dblp_profile': 'https://dblp.org/pid/c/NickCraswell.html'}, {'name': 'Bhaskar Mitra', 'dblp_profile': 'https://dblp.org/pid/147/9120-1.html'}, {'name': 'Emine Yilmaz', 'dblp_profile': 'https://dblp.org/pid/36/3270.html'}, {'name': 'Daniel Campos', 'dblp_profile': 'https://dblp.org/pid/64/1314.html'}, {'name': 'Jimmy Lin', 'dblp_profile': 'https://dblp.org/pid/00/7739'}]",2021,"This is the third year of the TREC Deep Learning track. As in previous years, we leverage the MS MARCO datasets that made hundreds of thousands of human annotated training labels available for both passage and document ranking tasks. In addition, this year we refreshed both the document and the passage collections which also led to a nearly four times increase in the document collection size and nearly 16 times increase in the size of the passage collection. Deep neural ranking models that employ large scale pretraininig continued to outperform traditional retrieval methods this year. We also found that single stage retrieval can achieve good performance on both tasks although they still do not perform at par with multistage retrieval pipelines. Finally, the increase in the collection size and the general data refresh raised some questions about completeness of NIST judgments and the quality of the training labels that were mapped to the new collections from the old ones which we discuss in this report. The best “nnlm” run outperforms the best “trad run” on 41 out of 57 ( 72% ) queries for the document ranking task—a drop-off from 84% as in the previous two years. For the passage ranking task, the best “nnlm” run wins on 47 out of 53 ( 89% ) queries against the best “trad” run, which is marginally higher than 84% in 2019 and 88% in 2020.",c3df8f8b7f1ed68f0ffeef6afcf60039f955b397
Pretrained Transformers for Text Ranking: BERT and Beyond,"[{'name': 'Andrew Yates', 'dblp_profile': 'https://dblp.org/pid/49/7109.html'}, {'name': 'Rodrigo Frassetto Nogueira', 'dblp_profile': 'https://dblp.org/pid/175/1545.html'}, {'name': 'Jimmy Lin', 'dblp_profile': 'https://dblp.org/pid/00/7739'}]",2021,"The goal of text ranking is to generate an ordered list of texts retrieved from a corpus in response to a query. Although the most common formulation of text ranking is search, instances of the task can also be found in many natural language processing applications. This tutorial, based on a forthcoming book, provides an overview of text ranking with neural network architectures known as transformers, of which BERT is the best-known example. The combination of transformers and self-supervised pretraining has, without exaggeration, revolutionized the fields of natural language processing (NLP), information retrieval (IR), and beyond. We provide a synthesis of existing work as a single point of entry for both researchers and practitioners. Our coverage is grouped into two categories: transformer models that perform reranking in multi-stage ranking architectures and learned dense representations that perform ranking directly. Two themes pervade our treatment: techniques for handling long documents and techniques for addressing the tradeoff between effectiveness (result quality) and efficiency (query latency). Although transformer architectures and pretraining techniques are recent innovations, many aspects of their application are well understood. Nevertheless, there remain many open research questions, and thus in addition to laying out the foundations of pretrained transformers for text ranking, we also attempt to prognosticate the future.",88b0eea7050c3322162c0cf18b2ccb014c4d17ad
The Expando-Mono-Duo Design Pattern for Text Ranking with Pretrained Sequence-to-Sequence Models,"[{'name': 'Ronak Pradeep', 'dblp_profile': 'https://dblp.org/pid/270/1757.html'}, {'name': 'Rodrigo Frassetto Nogueira', 'dblp_profile': 'https://dblp.org/pid/175/1545.html'}, {'name': 'Jimmy Lin', 'dblp_profile': 'https://dblp.org/pid/00/7739'}]",2021,"We propose a design pattern for tackling text ranking problems, dubbed""Expando-Mono-Duo"", that has been empirically validated for a number of ad hoc retrieval tasks in different domains. At the core, our design relies on pretrained sequence-to-sequence models within a standard multi-stage ranking architecture.""Expando""refers to the use of document expansion techniques to enrich keyword representations of texts prior to inverted indexing.""Mono""and""Duo""refer to components in a reranking pipeline based on a pointwise model and a pairwise model that rerank initial candidates retrieved using keyword search. We present experimental results from the MS MARCO passage and document ranking tasks, the TREC 2020 Deep Learning Track, and the TREC-COVID challenge that validate our design. In all these tasks, we achieve effectiveness that is at or near the state of the art, in some cases using a zero-shot approach that does not exploit any training data from the target task. To support replicability, implementations of our design pattern are open-sourced in the Pyserini IR toolkit and PyGaggle neural reranking library.",e08eed9608382beea1febca49119c665fbabd031
Pyserini: An Easy-to-Use Python Toolkit to Support Replicable IR Research with Sparse and Dense Representations,"[{'name': 'Jimmy Lin', 'dblp_profile': 'https://dblp.org/pid/00/7739'}, {'name': 'Xueguang Ma', 'dblp_profile': 'https://dblp.org/pid/44/9030.html'}, {'name': 'Sheng-Chieh Lin', 'dblp_profile': 'https://dblp.org/pid/61/10361.html'}, {'name': 'Jheng-Hong Yang', 'dblp_profile': 'https://dblp.org/pid/227/0821.html'}, {'name': 'Ronak Pradeep', 'dblp_profile': 'https://dblp.org/pid/270/1757.html'}, {'name': 'Rodrigo Frassetto Nogueira', 'dblp_profile': 'https://dblp.org/pid/175/1545.html'}]",2021,"Pyserini is an easy-to-use Python toolkit that supports replicable IR research by providing effective first-stage retrieval in a multi-stage ranking architecture. Our toolkit is self-contained as a standard Python package and comes with queries, relevance judgments, pre-built indexes, and evaluation scripts for many commonly used IR test collections. We aim to support, out of the box, the entire research lifecycle of efforts aimed at improving ranking with modern neural approaches. In particular, Pyserini supports sparse retrieval (e.g., BM25 scoring using bag-of-words representations), dense retrieval (e.g., nearest-neighbor search on transformer-encoded representations), as well as hybrid retrieval that integrates both approaches. This paper provides an overview of toolkit features and presents empirical results that illustrate its effectiveness on two popular ranking tasks. We also describe how our group has built a culture of replicability through shared norms and tools that enable rigorous automated testing.",5ac627f229fa8d54f5ad43f7f99e9b29d93ada29
Significant Improvements over the State of the Art? A Case Study of the MS MARCO Document Ranking Leaderboard,"[{'name': 'Jimmy Lin', 'dblp_profile': 'https://dblp.org/pid/00/7739'}, {'name': 'Daniel Campos', 'dblp_profile': 'https://dblp.org/pid/64/1314.html'}, {'name': 'Nick Craswell', 'dblp_profile': 'https://dblp.org/pid/c/NickCraswell.html'}, {'name': 'Bhaskar Mitra', 'dblp_profile': 'https://dblp.org/pid/147/9120-1.html'}, {'name': 'Emine Yilmaz', 'dblp_profile': 'https://dblp.org/pid/36/3270.html'}]",2021,"Leaderboards are a ubiquitous part of modern research in applied machine learning. By design, they sort entries into some linear order, where the top-scoring entry is recognized as the ""state of the art"" (SOTA). Due to the rapid progress being made today, particularly with neural models, the top entry in a leaderboard is replaced with some regularity. These are touted as improvements in the state of the art. Such pronouncements, however, are almost never qualified with significance testing. In the context of the MS MARCO document ranking leaderboard, we pose a specific question: How do we know if a run is significantly better than the current SOTA? Against the backdrop of recent IR debates on scale types, our study proposes an evaluation framework that explicitly treats certain outcomes as distinct and avoids aggregating them into a single-point metric. Empirical analysis of SOTA runs from the MS MARCO document ranking leaderboard reveals insights about how one run can be ""significantly better"" than another that are obscured by the current official evaluation metric (MRR@100).",6ee287800c2aecef59d2b1d98c0ebfcab4294f53
Investigating the Limitations of the Transformers with Simple Arithmetic Tasks,"[{'name': 'Rodrigo Frassetto Nogueira', 'dblp_profile': 'https://dblp.org/pid/175/1545.html'}, {'name': 'Zhiying Jiang', 'dblp_profile': 'https://dblp.org/pid/21/1662.html'}, {'name': 'Jimmy Lin', 'dblp_profile': 'https://dblp.org/pid/00/7739'}]",2021,"The ability to perform arithmetic tasks is a remarkable trait of human intelligence and might form a critical component of more complex reasoning tasks. In this work, we investigate if the surface form of a number has any influence on how sequence-to-sequence language models learn simple arithmetic tasks such as addition and subtraction across a wide range of values. We find that how a number is represented in its surface form has a strong influence on the model's accuracy. In particular, the model fails to learn addition of five-digit numbers when using subwords (e.g.,""32""), and it struggles to learn with character-level representations (e.g.,""3 2""). By introducing position tokens (e.g.,""3 10e1 2""), the model learns to accurately add and subtract numbers up to 60 digits. We conclude that modern pretrained language models can easily learn arithmetic from very few examples, as long as we use the proper surface representation. This result bolsters evidence that subword tokenizers and positional encodings are components in current transformer designs that might need improvement. Moreover, we show that regardless of the number of parameters and training examples, models cannot learn addition rules that are independent of the length of the numbers seen during training. Code to reproduce our experiments is available at https://github.com/castorini/transformers-arithmetic",2cc3ab9fa41ba2804e301f7eae9598636e62422a
